{
  "spill_id": "demo-SAR-001",
  "timestamp": "2026-08-27T03:21:20.688678Z",
  "source_estimation": {
    "latitude": -17.459822326768037,
    "longitude": 147.535712055848,
    "confidence": 0.35,
    "method": "backward_drift_trace_mvp"
  },
  "spill_movement": {
    "current_position": {
      "latitude": NaN,
      "longitude": NaN,
      "timestamp": "2026-08-27T03:21:20.688678Z"
    },
    "predicted_positions": [
      {
        "time": "2022-07-15T06:00:00.000000Z",
        "latitude": -18.0,
        "longitude": 147.0
      },
      {
        "time": "2022-07-15T07:00:00.000000Z",
        "latitude": -18.022546768188477,
        "longitude": 146.97653198242188
      },
      {
        "time": "2022-07-15T08:00:00.000000Z",
        "latitude": -18.045019149780273,
        "longitude": 146.9530792236328
      },
      {
        "time": "2022-07-15T09:00:00.000000Z",
        "latitude": -18.06755828857422,
        "longitude": 146.92965698242188
      },
      {
        "time": "2022-07-15T10:00:00.000000Z",
        "latitude": -18.090145111083984,
        "longitude": 146.90625
      },
      {
        "time": "2022-07-15T11:00:00.000000Z",
        "latitude": -18.112689971923828,
        "longitude": 146.88284301757812
      },
      {
        "time": "2022-07-15T12:00:00.000000Z",
        "latitude": -18.13515281677246,
        "longitude": 146.8594512939453
      },
      {
        "time": "2022-07-15T13:00:00.000000Z",
        "latitude": -18.157621383666992,
        "longitude": 146.83609008789062
      },
      {
        "time": "2022-07-15T14:00:00.000000Z",
        "latitude": -18.180152893066406,
        "longitude": 146.812744140625
      },
      {
        "time": "2022-07-15T15:00:00.000000Z",
        "latitude": -18.202682495117188,
        "longitude": 146.789306640625
      },
      {
        "time": "2022-07-15T16:00:00.000000Z",
        "latitude": -18.2252254486084,
        "longitude": 146.765869140625
      },
      {
        "time": "2022-07-15T17:00:00.000000Z",
        "latitude": -18.247798919677734,
        "longitude": 146.74252319335938
      },
      {
        "time": "2022-07-15T18:00:00.000000Z",
        "latitude": -18.270376205444336,
        "longitude": 146.71908569335938
      },
      {
        "time": "2022-07-15T19:00:00.000000Z",
        "latitude": -18.292917251586914,
        "longitude": 146.69569396972656
      },
      {
        "time": "2022-07-15T20:00:00.000000Z",
        "latitude": -18.31551170349121,
        "longitude": 146.67225646972656
      },
      {
        "time": "2022-07-15T21:00:00.000000Z",
        "latitude": -18.33802032470703,
        "longitude": 146.6488800048828
      },
      {
        "time": "2022-07-15T22:00:00.000000Z",
        "latitude": -18.360687255859375,
        "longitude": 146.62545776367188
      },
      {
        "time": "2022-07-15T23:00:00.000000Z",
        "latitude": -18.38321876525879,
        "longitude": 146.6019287109375
      },
      {
        "time": "2022-07-16T00:00:00.000000Z",
        "latitude": -18.405790328979492,
        "longitude": 146.57850646972656
      },
      {
        "time": "2022-07-16T01:00:00.000000Z",
        "latitude": -18.428359985351562,
        "longitude": 146.5550994873047
      },
      {
        "time": "2022-07-16T02:00:00.000000Z",
        "latitude": -18.450891494750977,
        "longitude": 146.53172302246094
      },
      {
        "time": "2022-07-16T03:00:00.000000Z",
        "latitude": -18.473560333251953,
        "longitude": 146.50831604003906
      },
      {
        "time": "2022-07-16T04:00:00.000000Z",
        "latitude": -18.496196746826172,
        "longitude": 146.48487854003906
      },
      {
        "time": "2022-07-16T05:00:00.000000Z",
        "latitude": -18.51872444152832,
        "longitude": 146.46144104003906
      },
      {
        "time": "2022-07-16T06:00:00.000000Z",
        "latitude": -18.541324615478516,
        "longitude": 146.4380340576172
      },
      {
        "time": "2022-07-16T07:00:00.000000Z",
        "latitude": -18.563980102539062,
        "longitude": 146.41445922851562
      },
      {
        "time": "2022-07-16T08:00:00.000000Z",
        "latitude": -18.586503982543945,
        "longitude": 146.39093017578125
      },
      {
        "time": "2022-07-16T09:00:00.000000Z",
        "latitude": -18.60917854309082,
        "longitude": 146.367431640625
      },
      {
        "time": "2022-07-16T10:00:00.000000Z",
        "latitude": -18.629838943481445,
        "longitude": 146.34449768066406
      },
      {
        "time": "2022-07-16T11:00:00.000000Z",
        "latitude": -18.641765594482422,
        "longitude": 146.33045959472656
      },
      {
        "time": "2022-07-16T12:00:00.000000Z",
        "latitude": -18.659852981567383,
        "longitude": 146.3192138671875
      },
      {
        "time": "2022-07-16T13:00:00.000000Z",
        "latitude": -18.68467903137207,
        "longitude": 146.30946350097656
      },
      {
        "time": "2022-07-16T14:00:00.000000Z",
        "latitude": -18.72614860534668,
        "longitude": 146.2928009033203
      }
    ],
    "trajectory_geometry": {
      "type": "LineString",
      "coordinates": [
        [
          147.0,
          -18.0
        ],
        [
          146.97653198242188,
          -18.022546768188477
        ],
        [
          146.9530792236328,
          -18.045019149780273
        ],
        [
          146.92965698242188,
          -18.06755828857422
        ],
        [
          146.90625,
          -18.090145111083984
        ],
        [
          146.88284301757812,
          -18.112689971923828
        ],
        [
          146.8594512939453,
          -18.13515281677246
        ],
        [
          146.83609008789062,
          -18.157621383666992
        ],
        [
          146.812744140625,
          -18.180152893066406
        ],
        [
          146.789306640625,
          -18.202682495117188
        ],
        [
          146.765869140625,
          -18.2252254486084
        ],
        [
          146.74252319335938,
          -18.247798919677734
        ],
        [
          146.71908569335938,
          -18.270376205444336
        ],
        [
          146.69569396972656,
          -18.292917251586914
        ],
        [
          146.67225646972656,
          -18.31551170349121
        ],
        [
          146.6488800048828,
          -18.33802032470703
        ],
        [
          146.62545776367188,
          -18.360687255859375
        ],
        [
          146.6019287109375,
          -18.38321876525879
        ],
        [
          146.57850646972656,
          -18.405790328979492
        ],
        [
          146.5550994873047,
          -18.428359985351562
        ],
        [
          146.53172302246094,
          -18.450891494750977
        ],
        [
          146.50831604003906,
          -18.473560333251953
        ],
        [
          146.48487854003906,
          -18.496196746826172
        ],
        [
          146.46144104003906,
          -18.51872444152832
        ],
        [
          146.4380340576172,
          -18.541324615478516
        ],
        [
          146.41445922851562,
          -18.563980102539062
        ],
        [
          146.39093017578125,
          -18.586503982543945
        ],
        [
          146.367431640625,
          -18.60917854309082
        ],
        [
          146.34449768066406,
          -18.629838943481445
        ],
        [
          146.33045959472656,
          -18.641765594482422
        ],
        [
          146.3192138671875,
          -18.659852981567383
        ],
        [
          146.30946350097656,
          -18.68467903137207
        ],
        [
          146.2928009033203,
          -18.72614860534668
        ]
      ]
    }
  },
  "spill_extent": {
    "area_km2": 0,
    "geometry": {
      "type": "Polygon",
      "coordinates": []
    }
  },
  "environmental_conditions": {
    "wind_speed_ms": 6.4,
    "wind_direction_deg": 245,
    "current_speed_ms": 0.8,
    "current_direction_deg": 220,
    "sea_surface_temp_c": 28.5
  },
  "risk": {
    "risk_level": "MEDIUM",
    "coastal_impact_probability": 0.85,
    "risk_score": 47.46
  },
  "metadata": {
    "simulation_duration_hours": 72,
    "num_particles": 1000,
    "particle_count_at_end": 1,
    "mean_drift_km": 109.95241521410522,
    "max_drift_km": 109.95241521410522
  }
}